<?xml version="1.0" encoding="UTF-8"?>
<xs:schema xmlns:xs="http://www.w3.org/2001/XMLSchema">
    <xs:element name="marcadores">
        <xs:complexType>
            <xs:sequence>
                <xs:element name="pagina" maxOccurs="unbounded">
                    <xs:complexType>
                        <xs:sequence>
                            <xs:element name="nombre" type="xs:string"></xs:element>
                            <xs:element name="descripccion" type="xs:string"></xs:element>
                            <xs:element name="url" type="xs:string"></xs:element>
                        </xs:sequence>
                    </xs:complexType>  
                </xs:element>
            </xs:sequence>
        </xs:complexType>
    </xs:element>
</xs:schema>